,Ticker,Score Final,Recomendación,% Subida a Máx,Crecimiento Futuro,País,Semáforo Riesgo,Contexto Global,Proyección 12M (%),Score Numérico Total,Fuente,Mínimo,Máximo,Actual,Forward EPS,Forward Revenue Growth,Margen Futuro,Sector,Tipo,PEG Ratio,P/E Ratio,P/B Ratio,ROE,ROIC,FCF Yield,Debt/Equity,EV/EBITDA,Dividend Yield,Beta,Revenue Growth YoY,Contexto,VIX,Riesgo País,Cobertura,Target Base 12M,Target Alcista 12M,Target Conservador,Justificación Score,Advertencia
28,AMZN,⭐⭐ (2/5 - Riesgoso),❌ Evitar,20.43,🟡 Moderado,usa,AMARILLO,Contexto Global: MODERADO,-44.92,5,Yahoo Finance,5.43,242.06,200.99,6.15,8.6,,Consumer Cyclical,Acción,0.51,32.78793,6.9739766,0.2524,0.07632,1.84,51.641,17.418,,1.308,0.086,"Amazon.com, Inc. se involucra en la venta minorista de productos de consumo, publicidad y servicio de suscripciones a través de tiendas en línea y físicas en América del Norte e internacionalmente. La compañía opera a través de tres segmentos: North America, International y Amazon Web Services (AWS). También fabrica y vende dispositivos electrónicos, incluyendo Kindle, tabletas de fuego, televisores de fuego, eco, anillo, parpadeo y eero; y desarrolla y produce contenido de medios. Además, la compañía ofrece programas que permiten a los vendedores vender sus productos en sus tiendas; y programas que permiten a los autores, editores independientes, músicos, cineastas, streamers de twitch, desarrolladores de habilidades y aplicaciones, y otros publicar y vender contenido. Además, proporciona cómputo, almacenamiento, base de datos, análisis, aprendizaje automático y otros servicios, así como servicios de publicidad a través de programas, como anuncios patrocinados, exhibición y publicidad de video. Además, la compañía ofrece Amazon Prime, un programa de membresía. Los productos de la compañía ofrecidos a través de sus tiendas incluyen mercancías y contenido comprado para reventa y productos ofrecidos por vendedores externos. Sirve a consumidores, vendedores, desarrolladores, empresas, creadores de contenido, anunciantes y empleados. Amazon.com, Inc. se incorporó en 1994 y tiene su sede en Seattle, Washington.",22.29,50,8/8,110.7,153.75,73.8,"ROE > 10%,PEG Ratio razonable,FCF positivo,EPS futuro positivo,Contexto global favorable (+1)",
4,AAPL,⭐⭐ (2/5 - Riesgoso),❌ Evitar,32.33,🟡 Moderado,usa,AMARILLO,Contexto Global: MODERADO,-23.4,6,Yahoo Finance,5.77,258.4,195.27,8.31,5.1,,Technology,Acción,6.34,30.415888,43.674793,1.38015,0.23809999,3.33,146.994,21.36,0.53,1.275,0.051,"Apple Inc. diseña, fabrica y comercializa teléfonos inteligentes, computadoras personales, tabletas, wearables y accesorios en todo el mundo. La compañía ofrece iPhone, una línea de teléfonos inteligentes; Mac, una línea de computadoras personales; iPad, una línea de tabletas multipropósito; y wearables, hogar y accesorios que comprenden AirPods, Apple TV, Apple Watch, Beats Products y HomePod. También proporciona soporte de Applecare y servicios en la nube; y opera varias plataformas, incluida la App Store que permite a los clientes descubrir y descargar aplicaciones y contenido digital, como libros, música, videos, juegos y podcasts, así como los servicios de publicidad incluyen arreglos de licencias de terceros y sus propias plataformas de publicidad. Además, la compañía ofrece varios servicios basados ​​en suscripción, como Apple Arcade, un servicio de suscripción de juegos; Apple Fitness+, un servicio de fitness personalizado; Apple Music, que ofrece a los usuarios una experiencia auditiva curada con estaciones de radio a pedido; Apple News+, un servicio de noticias y revistas de suscripción; Apple TV+, que ofrece contenido original exclusivo; Apple Card, una tarjeta de crédito de marca compartida; y Apple Pay, un servicio de pago sin efectivo, así como con licencia de su propiedad intelectual. La compañía atiende a los consumidores y pequeñas y medianas empresas; y la educación, la empresa y los mercados gubernamentales. Distribuye aplicaciones de terceros para sus productos a través de la App Store. La compañía también vende sus productos a través de sus tiendas minoristas y en línea, y la fuerza de ventas directa; y portadores de redes celulares de terceros, mayoristas, minoristas y revendedores. Apple Inc. fue fundada en 1976 y tiene su sede en Cupertino, California.",22.29,50,8/8,149.58,207.75,99.72,"ROE > 10%,ROIC > 8%,FCF positivo,Dividendo > 2%,EPS futuro positivo,Contexto global favorable (+1)",
12,XLE,⭐⭐ (2/5 - Riesgoso),❌ Evitar,16.74,🔴 Bajo,default,ROJO,Contexto Global: MODERADO,,4,Yahoo Finance,19.08,95.71,81.99,,,,,Acción,,14.737919,1.5732514,,,,,,3.55,,,"Al tratar de rastrear el rendimiento del índice, el fondo emplea una estrategia de replicación. Generalmente invierte sustancialmente todos, pero al menos el 95%, de sus activos totales en los valores que comprenden el índice. El índice incluye compañías que han sido identificadas como compañías de energía por el GICS®, incluidos valores de empresas de las siguientes industrias: petróleo, gas y combustibles consumibles; y equipos y servicios de energía. No está diversificado.",22.29,400,2/8,,,,"P/E < 20,P/B < 3,Dividendo > 2%,Contexto global favorable (+1),Sin proyección por EPS negativo o datos inválidos",
24,TLEVISACPO.MX,⭐⭐ (2/5 - Riesgoso),❌ Evitar,1325.03,🔴 Bajo,mexico,ROJO,Contexto Global: MODERADO,444.35,6,Yahoo Finance,6.62,112.15,7.87,2.38,-6.1,,Communication Services,Acción,,,0.20745797,-0.07484,-0.0015199999,39.12,92.479,4.916,4.45,1.558,-0.061,"Grupo Televisa, S.A.B., junto con sus subsidiarias, posee y opera compañías de cable y ofrece un sistema de televisión de pago satelital directo a casa en México e internacionalmente. Funciona a través de segmentos de cable y cielo. La compañía ofrece suscripción de televisión básica y premium, pago por visión, instalación, suscripción de Internet y suscripción de servicios telefónicos y móviles, así como servicios publicitarios locales y nacionales; y datos y soluciones de servicios de larga distancia a operadores y otros proveedores de servicios de telecomunicaciones a través de su red de fibra óptica. También proporciona servicios de televisión de pago satelital de transmisión directa a casa que comprenden servicios de programación, instalación y alquiler de equipos a suscriptores; y ventas nacionales de publicidad. Grupo Televisa, S.A.B. fue fundada en 1969 y tiene su sede en la Ciudad de México, México.",22.29,320,6/8,42.84,59.5,28.56,"EV/EBITDA < 15,FCF positivo,FCF > 5%,P/B < 3,Dividendo > 2%,Potencial subida > 40%,EPS futuro positivo,Crecimiento futuro negativo,ROE negativo,Contexto global favorable (+1)",
26,MELI,⭐⭐ (2/5 - Riesgoso),❌ Evitar,3.91,🟢 Alto,uruguay,ROJO,Contexto Global: MODERADO,-65.28,5,Yahoo Finance,35.24,2606.01,2507.83,48.38,37,,Consumer Cyclical,Acción,1.42,61.723602,25.407839,0.49106997,0.07739,1.24,155.016,35.939,,1.613,0.37,"Mercadolibre, Inc. opera plataformas de comercio en línea en Brasil, México, Argentina e internacionalmente. La compañía opera Mercado Libre Marketplace, una plataforma de comercio en línea a la que se puede acceder a través de la aplicación móvil o el sitio web; y Mercado Pago, una plataforma de solución de tecnología financiera, que ofrece un conjunto integral de servicios de tecnología financiera a los usuarios y otros usuarios de su plataforma de comercio electrónico. También proporciona Mercado Fondo que permite a los usuarios invertir fondos depositados en sus cuentas de Mercado Pago; Mercado Credito, que otorga préstamos y obtiene mejores alternativas de financiación; y Mercado Mercado Envios que facilita el envío de bienes de la compañía y los vendedores a los compradores. Además, la compañía proporciona Mercado Libre Classifieds, donde los usuarios pueden enumerar vehículos, propiedades y servicios; Mercado ADS, una plataforma publicitaria, que permite a los minoristas y marcas promocionar sus productos y servicios en la plataforma; y Mercado Shops que permite a los usuarios configurar, administrar y promover sus propias tiendas web en línea bajo un modelo de negocio basado en suscripción. Mercadolibre, Inc. se incorporó en 1999 y tiene su sede en Montevideo, Uruguay.",22.29,400,8/8,870.84,1209.5,580.56,"ROE > 10%,PEG Ratio razonable,FCF positivo,EPS futuro positivo,Crecimiento futuro > 10%,P/E > 60 (penaliza),Contexto global favorable (+1)",
21,AZUL4.SA,⭐⭐ (2/5 - Riesgoso),❌ Evitar,5900.96,🟢 Alto,brazil,ROJO,Contexto Global: MODERADO,,5,Yahoo Finance,1.02,62.41,1.04,-0.96,15.299999999999999,,Industrials,Acción,,,-0.01622566,,0.10589,294.29,,7.994,,1.616,0.153,"Azul S.A., junto con sus subsidiarias, proporciona servicios de transporte aéreo en Brasil e internacionalmente. También está involucrado en la carga o el correo; charter de pasajeros; desarrollo de programas de flyer frecuentes; propietario de la propiedad intelectual; paquetes de viaje; Financiación: financiación de aviones; y provisión de servicios de mantenimiento y ahorro para aviones, motores, piezas y piezas, adquisición de aviones y servicios de arrendamiento. Al 31 de diciembre de 2023, la compañía operaba aproximadamente 980 salidas diarias a 160 destinos a través de una red de 400 rutas sin parar; con una flota operativa de 181 aviones y una flota contractual de pasajeros de 185 aviones. La compañía fue incorporada en 2008 y tiene su sede en Barueri, Brasil.",22.29,260,5/8,,,,"EV/EBITDA < 15,ROIC > 8%,FCF positivo,FCF > 5%,Potencial subida > 40%,EPS futuro negativo,Crecimiento futuro > 10%,Penalización sectorial por brazil/industrials (-1),Contexto global favorable (+1),Sin proyección por EPS negativo o datos inválidos",
33,CAT,⭐⭐ (2/5 - Riesgoso),❌ Evitar,20.38,🔴 Bajo,usa,AMARILLO,Contexto Global: MODERADO,16.11,6,Yahoo Finance,34.53,413.37,343.39,22.15,-9.8,,Industrials,Acción,,16.750732,8.95294,0.55646,0.09403,4.22,213.547,13.36,1.64,1.346,-0.098,"Caterpillar Inc. fabrica y vende equipos de construcción y minería, motores diesel y de gas natural fuera de la carretera, turbinas de gas industrial y locomotoras diesel-eléctricas en los Estados Unidos e internacionalmente. Su segmento de la Industria de Construcción ofrece adoquines de asfalto, cepilladores fríos, compactadores, máquinas forestales, manejadores de materiales, alumnos de motor, tuberías, recuperadores de carreteras, manzadores telesportantes, tractores de tipo vía y excavadoras de vías y ruedas; Pista compacta, rueda, tipo de pista, retroexcavadora y cargadores de skid; y piezas y herramientas relacionadas. El segmento de las industrias de recursos de la compañía proporciona cuerdas eléctricas y palas hidráulicas, draglines, taladros rotativos, vehículos de roca dura, tractores, camiones mineros, cargadores de ruedas, camiones fuera de punto y camiones articulados, camiones de cuerpo ancho, raspadores de tractores y soluciones de tractores de ruedas, trabajos de gestión de flotas, tierras y tierras de seguridad de suelos, y tierras de seguridad, y tierras de seguridad, y tierras. soluciones, así como piezas y servicios relacionados. Su segmento de Energía y Transporte ofrece conjuntos de generadores con motor recíproco con motor; motores alternativos, transmisión y sistemas y soluciones integrados; turbinas, compresores de gas centrífuga y servicios relacionados; y locomotoras y componentes diesel-eléctricos, y otros productos relacionados con el riel. El segmento de productos financieros de la Compañía proporciona arrendamientos operativos y financieros, contratos de venta a plazos, cuentas de cargos rotativos, servicios de reparación/financiamiento de reconstrucción, préstamos de capital de trabajo y financiamiento mayorista; y productos y servicios de gestión de seguros y riesgos. Todos los demás segmentos ofrecen componentes de desgaste y mantenimiento; distribución de piezas; Soluciones logísticas y servicios de distribución; Gestión de la cartera de distribuidores y servicios de estrategia de gestión de marca y marketing; y servicios de inversión digital. Caterpillar Inc. fue fundada en 1925 y tiene su sede en Irving, Texas.",22.29,50,7/8,398.7,553.75,265.8,"EV/EBITDA < 15,ROE > 10%,ROIC > 8%,FCF positivo,P/E < 20,Dividendo > 2%,EPS futuro positivo,Crecimiento futuro negativo,Penalización sectorial por usa/industrials (-1),Contexto global favorable (+1)",
30,LOMA,⭐⭐ (2/5 - Riesgoso),❌ Evitar,55.27,🔴 Bajo,argentina,AMARILLO,Contexto Global: ADVERSO,13.64,5,Yahoo Finance,2.75,21.4,13.78,0.87,-8.9,,Basic Materials,Acción,,19.138887,0.0018215678,0.13898,0.054190002,-664.88,22.71,1.176,,1.093,-0.089,"Loma Negra Compañía Industrial Argentina Sociedad Anónima, junto con sus subsidiarias, fabrica y vende cemento y sus derivados en Argentina. La compañía opera a través de cemento, mampostería y lima; Concreto; Servicios ferroviarios; Agregados; y otros segmentos. Ofrece cemento de mampostería, agregados, concreto, concreto y lima a distribuidores mayoristas, productores de concreto, clientes industriales y otros para su uso en la construcción. La compañía también ofrece servicios de transporte ferroviario; y trata y recicla los desechos industriales para su uso como combustible y materia prima. Comercializa sus productos bajo Loma Negra, San Martín, Plasticor, Cacique Plus, Cacique Max, Loma Negra Plus y Lomax Brands. La compañía fue fundada en 1926 y tiene su sede en Buenos Aires, Argentina. Loma Negra Compañía Industrial Argentina Sociedad Anónima opera como una subsidiaria del intercambio de intercambios e inversiones argentina Sociedad Limitada.",22.29,1450,7/8,15.66,21.75,10.44,"EV/EBITDA < 15,ROE > 10%,P/E < 20,P/B < 3,Potencial subida > 40%,EPS futuro positivo,Crecimiento futuro negativo",
8,QQQ,⭐ (1/5 - Débil),❌ Evitar,5.79,🔴 Bajo,default,ROJO,Contexto Global: MODERADO,,3,Yahoo Finance,37.17,538.72,509.24,,,,,Acción,,31.934755,1.4233567,,,,,,0.63,,,"Para mantener la correspondencia entre la composición y los pesos de los valores en el fideicomiso (los ""valores"") y las acciones en el índice NASDAQ-100, el asesor ajusta los valores de vez en cuando para cumplir con los cambios periódicos en la identidad y/o los pesos relativos de los valores de índice. La composición y ponderación de la parte de valores de un depósito de cartera también se ajustan para cumplir con los cambios en el índice.",22.29,400,2/8,,,,"P/B < 3,Dividendo > 2%,Contexto global favorable (+1),Sin proyección por EPS negativo o datos inválidos",
56,SEDG,⭐ (1/5 - Débil),❌ Evitar,2104.91,🟡 Moderado,israel,AMARILLO,Contexto Global: MODERADO,,3,Yahoo Finance,10.47,368.33,16.7,-2.45,7.3999999999999995,,Technology,Acción,,,1.638709,-1.23296,-0.25206,18.19,127.576,-0.845,,1.493,0.074,"Solaredge Technologies, Inc., junto con sus subsidiarias, diseña, desarrolla, fabrica y vende sistemas de inversores optimizados de corriente continua (DC) para instalaciones solares fotovoltaicas (PV) en los Estados Unidos, Alemania, los Países Bajos, Italia, el resto de Europa e internacionalmente. La compañía ofrece optimizadores de energía, inversores, celdas de iones de litio, baterías, soluciones de almacenamiento, cargadores de vehículos eléctricos y gestión de software de carga EV, productos de energía inteligente, rastreadores inteligentes y productos de software de gestión de energía inteligente; Plataforma de monitoreo, una plataforma de monitoreo basada en la nube, que recopila potencia, voltaje, temperatura de corriente y otros datos enviados desde inversores y optimizadores de potencia; y la aplicación Mysolaredge, que permite a los propietarios de sistemas rastrear su producción en tiempo real y consumo de energía doméstica. También proporciona la aplicación SolarDege Go, una aplicación móvil para instaladores, integración de instalación, administración y capacidades de servicio; Designer Platform, una herramienta basada en la web que ayuda a los profesionales solares a planificar, construir, simular y validar sistemas residenciales y comerciales; Aplicación mapeador para registrar el diseño físico de nuevos sitios fotovoltaicos instalados con sistemas de inversor optimizados de CC; Aplicación SetApp, que activa y configra inversores; y servicios de cuadrícula. Además, la compañía ofrece soporte preventivo y servicios de capacitación continua, así como soporte técnico antes, durante y después de los servicios de instalación. Sirve instaladores solares; Proveedores de sistemas solares fotovoltaicos a usuarios finales residenciales y comerciales; distribuidores solares clave; empresas de ingeniería, adquisición y construcción; y mayoristas de equipos eléctricos. Solaredge Technologies, Inc. se incorporó en 2006 y tiene su sede en Herzliya Pituach, Israel.",22.29,400,6/8,,,,"FCF positivo,FCF > 5%,P/B < 3,Potencial subida > 40%,EPS futuro negativo,ROE negativo,Contexto global favorable (+1),Sin proyección por EPS negativo o datos inválidos",
61,DQ,⭐ (1/5 - Débil),❌ Evitar,804.08,🔴 Bajo,china,VERDE,Contexto Global: MODERADO,,0,Yahoo Finance,0.74,124.13,13.73,-1.28,-70.19999999999999,,Technology,Acción,,,0.21229221,-0.09329,-0.047399998,-43.8,,-13.531,,0.58,-0.702,"Daqo New Energy Corp., junto con sus subsidiarias, fabrica y vende Polysilicon a fabricantes de productos fotovoltaicos en la República Popular de China. Sus productos se utilizan en lingotes, obleas, células y módulos para soluciones de energía solar. La compañía fue conocida anteriormente como Mega Stand International Limited y cambió su nombre a Daqo New Energy Corp. en agosto de 2009. La compañía fue fundada en 2006 y tiene su sede en Shanghai, la República Popular de China.",22.29,70,6/8,,,,"Beta <= 1,P/B < 3,Potencial subida > 40%,EPS futuro negativo,Crecimiento futuro negativo,ROE negativo,Penalización sectorial por china/technology (-1),Contexto global favorable (+1),Sin proyección por EPS negativo o datos inválidos",
60,PLUG,⭐ (1/5 - Débil),❌ Evitar,9282.05,🟡 Moderado,usa,ROJO,Contexto Global: MODERADO,,1,Yahoo Finance,0.12,73.18,0.78,-0.57,11.200000000000001,,Industrials,Acción,,,0.4105263,-0.82522005,-0.15126,-75.16,51.057,-1.694,,2.189,0.112,"Plug Power Inc. desarrolla soluciones de productos de celdas de combustible de hidrógeno en América del Norte, Europa, Asia e internacionalmente. La compañía ofrece Gendrive, un sistema de celdas de combustible de intercambio de protones alimentado por hidrógeno (PEM) que proporciona energía para el manejo de los vehículos eléctricos; Gensure, una solución estacionaria de pila de combustible que ofrece potencia modular de pila de combustible PEM para soportar los requisitos de potencia de respaldo y soporte de la red de los sectores de telecomunicaciones, transporte y utilidad; y Progen, una pila de celdas de combustible y tecnología de motor utilizada en sistemas de movilidad y celdas de combustible estacionarias. También ofrece Genfuel, un sistema de suministro, generación, almacenamiento y dispensación de hidrógeno líquido; Gencare, un programa continuo de Internet de mantenimiento basado en cosas y servicios en el sitio para sistemas de celdas de combustible de gendrive; Sistemas de celdas de combustible de gases; Almacenamiento de hidrógeno Genfuel y productos dispensadores; Motores de pila de combustible de progenisos; y Genkey, una solución de llave llave integrada para la transición a la potencia de la celda de combustible. Además, la compañía también proporciona electrolizeros, un generador de hidrógeno para la producción de hidrógeno limpio; sistemas de licuefacción que proporcionan hidrógeno líquido a los clientes; Equipo criogénico para la distribución de hidrógeno licuado, oxígeno, argón, nitrógeno y otros gases criogénicos, incluidos remolques y equipos de almacenamiento móvil; e hidrógeno líquido, una alternativa al combustible a la energía a base de fósiles. La compañía vende sus productos a través de una fuerza directa de ventas de productos, fabricantes de equipos originales y redes de distribuidores. Plug Power Inc. se incorporó en 1997 y tiene su sede en Latham, Nueva York.",22.29,50,6/8,,,,"P/B < 3,Potencial subida > 40%,EPS futuro negativo,Crecimiento futuro > 10%,ROE negativo,Penalización sectorial por usa/industrials (-1),Contexto global favorable (+1),Sin proyección por EPS negativo o datos inválidos",
3,TSLA,⭐ (1/5 - Débil),❌ Evitar,41.41,🔴 Bajo,usa,ROJO,Contexto Global: MODERADO,-82.81,2,Yahoo Finance,1.05,479.86,339.34,3.24,-9.2,,Consumer Cyclical,Acción,,192.80682,14.636818,0.087740004,0.03724,0.31,17.407,85.251,,2.434,-0.092,"Tesla, Inc. diseña, desarrolla, fabrica, arranca y vende vehículos eléctricos, y sistemas de generación y almacenamiento de energía en los Estados Unidos, China e internacionalmente. La compañía opera en dos segmentos, automotriz; y generación y almacenamiento de energía. El segmento automotriz ofrece vehículos eléctricos, así como vende créditos regulatorios automotrices; y vehículo posterior a la venta de no preferencias, vehículos usados, taller y piezas de carrocería, sobrealimentación, mercancía minorista y servicios de seguro de vehículos. Este segmento también proporciona sedanes y vehículos utilitarios deportivos a través de ventas directas y usadas de vehículos, una red de sobrealimentadores Tesla y actualizaciones en la aplicación; Servicios de financiamiento y arrendamiento de compras; servicios para vehículos eléctricos a través de sus ubicaciones de servicio propiedad de la empresa y técnicos de servicio móvil Tesla; y garantías limitadas de vehículos y planes de servicio extendidos. El segmento de generación y almacenamiento de energía se involucra en el diseño, fabricación, instalación, venta y arrendamiento de productos de generación de energía solar y almacenamiento de energía, y servicios relacionados con clientes y servicios públicos residenciales, comerciales e industriales a través de su sitio web, tiendas y galerías, así como a través de una red de socios de canal. Este segmento también brinda servicios y reparaciones a sus clientes de productos energéticos, incluso bajo garantía; y varias opciones de financiamiento a sus clientes residenciales. La compañía fue conocida anteriormente como Tesla Motors, Inc. y cambió su nombre a Tesla, Inc. en febrero de 2017. Tesla, Inc. se incorporó en 2003 y tiene su sede en Austin, Texas.",22.29,50,7/8,58.32,81,38.88,"FCF positivo,Potencial subida > 40%,EPS futuro positivo,Crecimiento futuro negativo,P/E > 60 (penaliza),Contexto global favorable (+1)",
41,BMA,⭐ (1/5 - Débil),❌ Evitar,22.83,🔴 Bajo,argentina,VERDE,Contexto Global: ADVERSO,93.13,2,Yahoo Finance,7.66,115.85,94.32,10.12,-65.4,,Financial Services,Acción,,21.291197,0.014893002,0.076570004,0.022330001,,,,22.87,0.905,-0.654,"Banco Macro S.A. proporciona varios productos y servicios bancarios a clientes minoristas y corporativos en Argentina. Ofrece varios productos y servicios bancarios minoristas, como cuentas de ahorro y corriente, depósitos de tiempo, tarjetas de crédito y débito, préstamos financieros de consumo, préstamos hipotecarios, préstamos para automóviles, sobregiros, servicios relacionados con el crédito, cobertura de seguro de vivienda y automóvil, recaudación de impuestos, pagos de servicios públicos, cajeros automáticos y transferencias de dinero. La compañía también ofrece préstamos personales, descuentos en documentos, hipotecas residenciales, sobregiros, préstamos prometidos y préstamos con tarjetas de crédito a clientes minoristas. Además, ofrece productos y servicios bancarios corporativos, incluidos depósitos, préstamos, cheques de cobro de avances y factorización, préstamos garantizados, líneas de crédito para financiar el comercio exterior y los servicios de gestión de efectivo; y servicios de confianza, nómina y agencia financiera, así como tarjetas de crédito corporativas y otros productos especializados; e instalaciones de capital de trabajo, crédito para proyectos de inversión y transacciones de arrendamiento y comercio exterior. Además, la compañía proporciona servicios de transacciones, como gestión de efectivo, servicios de cobro, pagos a proveedores, servicios de nómina, transacciones de divisas y servicios de comercio exterior; Servicios de información que comprenden servicios de datos e interpimas a clientes corporativos; e servicios de banca por Internet y móviles. Además, ofrece productos de préstamos corporativos a corto y largo plazo. Banco Macro S.A. se incorporó en 1966 y tiene su sede en Buenos Aires, Argentina.",22.29,1450,6/8,182.16,253,121.44,"Beta <= 1,P/B < 3,Dividendo > 2%,EPS futuro positivo,Crecimiento futuro negativo,Penalización sectorial por argentina/financial services (-1)",
